{
  "profile": "integra-stellar-mux-v1",
  "rail": "stellar",
  "pattern": "native-field",
  "nativeField": "cap67-mux-id",
  "recovery": {
    "onChain": true,
    "zeroPartyRecoverable": false,
    "forwardIndexable": false
  },
  "assetBinding": "none",
  "successGate": "raw-field",
  "indexing": "account-scan:mux-prefix8",
  "finality": {
    "reversible": false,
    "note": "final on ledger close (Soroban SAC transfer) — no on-rail reversal; only atrHash[:8] rides in the CAP-67 mux id, so settlement alone confirms the prefix-8 match but does NOT recover the full hash (the full atrHash comes from off-chain extensions.legalContext.info); recourse is the record's elected forum (PAY-3/RCS-5), never dispute resolution"
  },
  "weldGrades": {
    "cap67-mux": "signature"
  },
  "lifecycleStates": ["proposed", "settled"]
}
