{
  "profile": "integra-aptos-overlay-v1",
  "rail": "aptos",
  "pattern": "overlay-contract",
  "recovery": {
    "onChain": true,
    "zeroPartyRecoverable": true,
    "forwardIndexable": false
  },
  "assetBinding": "proposal-only",
  "successGate": "raw-field",
  "indexing": "candidate-set:payment::PaymentSettled",
  "finality": {
    "reversible": false,
    "note": "final on execution (Move settle_payment) — no on-rail reversal; recourse is the record's elected forum (PAY-3/RCS-5), never dispute resolution"
  },
  "weldGrades": {
    "settle-payment": "signature"
  },
  "lifecycleStates": ["proposed", "settled"]
}
