{
  "profile": "mpp-evm-derived-v1",
  "rail": "evm:mpp",
  "protocol": "mpp",
  "pattern": "id-reuse",
  "recovery": {
    "onChain": true,
    "zeroPartyRecoverable": false,
    "forwardIndexable": false
  },
  "assetBinding": "filtered",
  "successGate": "structural",
  "indexing": "none",
  "finality": {
    "reversible": false,
    "note": "scoped to MPP's `authorization` credential type (§5.3), the only one of the four whose challengeHash reaches the chain — under the RECOMMENDED `permit2` type (§5.2) the same derived value is signature-committed in an off-chain EIP-712 witness, and `transaction`/`hash` (§5.4/§5.5) bind no challenge at all. Within that scope: final on settlement — the EIP-3009 authorization is consumed on-chain and there is no on-rail reversal; the weld is derivation-bound (nonce = keccak256(abi.encodePacked(challenge.id, challenge.realm)), draft-evm-charge-00 §5.3.1), so a candidate atrHash is VERIFIED against the on-chain nonce and never recovered from it; recourse is the record's elected forum (PAY-3/RCS-5), never dispute resolution. The §8.3.5 discharge rests on the ATR STATING the transaction parameters (LCP §6.1), not on ATR uniqueness: MPP binds the challenge id to the challenge parameters, and uniqueness alone does not satisfy that (§C.1). The tree checks it as OFR — `offerBoundStep`, required at TC-4 — so this weld is only as strong as the record's class. Zero-party-recoverable on-chain binding on this rail still requires an Overlay Contract per §8.3.2"
  },
  "weldGrades": {
    "authorization": "signature"
  },
  "lifecycleStates": ["proposed", "settled"]
}
