{
  "profile": "integra-hedera-memo-v1",
  "rail": "hedera",
  "pattern": "native-field",
  "nativeField": "transaction-memo",
  "recovery": {
    "onChain": true,
    "zeroPartyRecoverable": true,
    "forwardIndexable": false
  },
  "assetBinding": "none",
  "successGate": "raw-field",
  "indexing": "mirror-scan:memo",
  "finality": {
    "reversible": false,
    "note": "final on consensus (HTS transfer) — no on-rail reversal; recourse is the record's elected forum (PAY-3/RCS-5), never dispute resolution"
  },
  "weldGrades": {
    "transaction-memo": "signature"
  },
  "lifecycleStates": ["proposed", "settled"]
}
