{
  "profile": "integra-solana-memo-v1",
  "rail": "solana",
  "pattern": "native-field",
  "nativeField": "spl-memo",
  "recovery": {
    "onChain": true,
    "zeroPartyRecoverable": true,
    "forwardIndexable": false
  },
  "assetBinding": "none",
  "successGate": "raw-field",
  "indexing": "signature-scan:memo",
  "finality": {
    "reversible": false,
    "note": "final on confirmation (SPL transfer) — no on-rail reversal; recourse is the record's elected forum (PAY-3/RCS-5), never dispute resolution"
  },
  "weldGrades": {
    "spl-memo": "signature"
  },
  "lifecycleStates": ["proposed", "settled"]
}
