{
  "profile": "integra-sui-pay402-v1",
  "rail": "sui",
  "protocol": "x402",
  "pattern": "native-field",
  "nativeField": "pay402-payment-id",
  "recovery": {
    "onChain": true,
    "zeroPartyRecoverable": true,
    "forwardIndexable": false
  },
  "assetBinding": "proposal-only",
  "successGate": "structural",
  "indexing": "event-scan:PaymentSettled.payment_id",
  "finality": {
    "reversible": false,
    "note": "final on checkpoint (Pay402 settle_payment) — no on-rail reversal; recourse is the record's elected forum (PAY-3/RCS-5), never dispute resolution"
  },
  "weldGrades": {
    "pay402": "signature"
  },
  "lifecycleStates": ["proposed", "settled"]
}
