{
  "profile": "integra-canton-overlay-v1",
  "rail": "canton",
  "pattern": "overlay-contract",
  "recovery": {
    "onChain": true,
    "zeroPartyRecoverable": false,
    "forwardIndexable": false
  },
  "assetBinding": "none",
  "successGate": "structural",
  "indexing": "participant-query:LcpAnchor.atrHash",
  "finality": {
    "reversible": false,
    "note": "an LcpAnchor contract is only ever archived by a NEW transaction (Daml has no reversal); recourse is the record's elected forum (PAY-3/RCS-5), never dispute resolution"
  },
  "weldGrades": {
    "lcp-anchor": "tx"
  },
  "lifecycleStates": ["proposed", "anchored"]
}
