{
  "profile": "integra-xrpl-invoice-id-v1",
  "rail": "xrpl",
  "pattern": "native-field",
  "protocol": "x402",
  "nativeField": "InvoiceID",
  "recovery": {
    "onChain": true,
    "zeroPartyRecoverable": true,
    "forwardIndexable": false
  },
  "assetBinding": "none",
  "successGate": "raw-field",
  "indexing": "tx-scan:invoice-id",
  "finality": {
    "reversible": false,
    "note": "final on validation (tesSUCCESS) — no on-rail reversal; recourse is the record's elected forum (PAY-3/RCS-5), never dispute resolution"
  },
  "weldGrades": {
    "invoice-id": "signature",
    "tx-memo": "signature"
  },
  "lifecycleStates": ["proposed", "settled"]
}
